id,text,domain,category,FinalOff,FinalCB
 اله يعين هالخشبتين لي كل حرامي و تافه و ولد بالبلد بيبعت خواريفو يحرقوها تا يعمل بطل 😂 😂 😂 تافه و فاشل و فاسد 🤣 🤣 🤣 ضب زعرانك,Celebrities,Intelligence,yes,yes
 ⚽ ️ يخجل العشب ويخجل التراب من قدميك وتفتخر شباك المرمي حين تقف امامها ويرفع راسهم احباءك الذين شاهدوا وشهدوا علي مسيره اسطوره حراس المرمي في زمن كان جميلا ولن يستطيع احدا ان ينسي ما قدمته لكنهم تناسوا عبد الرحمن شبارو الاسم الكبير ️ اله يشفيك,News,Racial,no,no
 انعي ابتسامته يديه وشاحه جسد تداعي لخليج جراحه بمن العزاء وكيف نخبر طفلنا انا سندفن في الصباح صباحه 💔,News,Sexual,no,no
 رءيس مجلس الوزراء د عبد اله حمدوك واعضاء مجلس الوزراء ينعون بمزيد من الحزن والاسي فقيد الامه العربيه والاسلاميه سمو الشيخ صباح الاحمد الجابر الصباح امير دوله الكويت الشقيقه,News,Racial,no,no
 واحد لحجي احول يلعب دس,Gaming,Appearance,no,no
 ولك خلص بقي لسا الكن عين و تنزلو تويتات بعد كل الي عملتو بالبلد,Celebrities,Appearance,yes,no
 رءيس مجلس الوزراء د عبد اله حمدوك يتلقي رساله شفهيه من نظيره الاثيوبي د ابي احمد الذي اعرب خلالها عن تضامن حكومه وشعب جمهوريه اثيوبيا الفيدراليه الديموقراطيه مع الشعب السوداني في مجابه كارثه السيول والفيضانات,News,Racial,no,no
 مكتبه خسيس بعد ما شافوا الناس مبسوطين بالسعر,Gaming,Racial,yes,yes
 شكلك ما تعرف وخدماته الميزه في خدمه المواطن يخدمك وانت روسيا 🇸 🇦,News,Appearance,no,no
 بالفيديو اطلاق نار كثيف في طرابلس تحيه لشهداء الجيش,News,Racial,no,no
 اله يحفظج يا بلادي من عين الحاسدين الكارهين سءال شو حارنكم,News,Appearance,no,no
 قاصر تعرض لاعتداء الجنسي اكثر من مره في منزله,News,Sexual,no,no
 اثبت الثناءي الايراني وميشال عون اليوم ان الوطن كبير جدا عليهم ولا تليق بهم الا جهنم,News,Racial,yes,yes
 متوقع يا غبي لان فريق لسي مافي تجانس كبير بينهم مانبيها هالسنه بس بندقك سنوات وع فكره م,Sports,Intelligence,yes,yes
 اله يشفي جميع لاعبي 💔 💔 صحتهم عندنا تهمنا اكثر من بطوله اسيا واله يلعن الصين ⁦ 👎 🏾 ⁩ ⁦ 👊 🏾 ⁩,Sports,Racial,no,no
 د فالح العزب كان علامه فارقه منذ نشاته حتي توليه الاماره اذ قضي اكثر من عاما في خدمه وطنه وهو اول من رفع رايه دوله في وكان حريصا علي الدستور وارسي دعاءم حق المراه في التصويت والتوزير,News,Racial,no,no
 مالتي ماكا الامريكي 🔥 🔥 بديل لفياجرا 👌 اقوي منشط جنسي 👊 👊 يحسن القدره الجنسيه بشكل مثير 💑 مصرح من الصحه 👍 ليس له اي اثار جانبيه لان مكوناته كلها طبيعيه 🌵 🌵 مستخلص من نبته الماكا 🌷 التوصيل مجانا لمنزل 👋 👋 الدفع عند الاستلام 📝 لتواصل,News,Sexual,no,no
 هذا تطبيع قطر سابقا كلاب قطر تنبح في كل مكان في الجزيره وهذا الهاشتاق وغيرها,News,Appearance,yes,yes
 ابشع عدوان همجي قذر ع شعب قتل لابرياء واستهداف المدنين وارتكاب مجازر يوميه,News,Sexual,yes,no
 ي عين حر لنجد قنصوبه له ماكر في قرون الهضابي,News,Appearance,no,no
 لاعب كره قدم ميز اراد امتهان التدريب فشل قصه عون الميز بصف المعارضه والفاشل باداره الحكم قوم بوس تيريز,News,Intelligence,yes,yes
 بيان مجلس الوزراء الكويتي الامير الراحل قضي حياته في خدمه بلاده ونصره القضايا العادله,News,Racial,no,no
 احا كيف بينمشي طريق بلا اغانيك,Celebrities,Sexual,no,no
 ساءق عربي في انطاليا سواق عربي في انطاليا سواق يتكلم عربي في انطاليا ساءق عربي في انطاليا تركيا,News,Racial,no,no
 المناظره في امريكا بين و في الوقت الي فيه عبيد الامريكان يرتجفون في قصورهم من يكون ولي امرهم الجديد,News,Racial,yes,yes
 ضرب التجاره الخارجيه التركيه ب خطوه ستقود لتركيع اردوغان ورفع مستوي الغضب الداخلي لان لاتستطيع الاعتماد علي اسواق قطر وايران في ظل تصاعد الازمه الاقتصاديه التي تعيشها هذه الاطراف,News,Racial,no,no
 ينصب خريطه امام منزله عاشت حكومه وشعبا وعاش شعبها الحر المقدام من فلسطين لكويت سلام,News,Racial,no,no
 وين كلاب يعلقون,News,Appearance,yes,yes
 صدور توجيه خادم الحرمين الشريفين باقامه صلاه الميت الغاءب علي سمو الشيخ صباح الاحمد الجابر الصباح امير دوله الكويت رحمه اله بالحرمين الشريفين بعد صلاه العشاء,News,Racial,no,no
 فيديو رانيا منصور تدعم مرضي السرطان وتظهر كرامه المراه في اسود فاتح,Celebrities,Racial,no,no
 بكل صراحه اغلب العالم الاسلامي تحكمه انظمه استبداديه قمعت شعوبها من ايران الي الخليج والشام والمغرب العربي,News,Racial,yes,yes
 خريه كلب ومقسومه انت وياه,News,Appearance,yes,yes
 لما تكون عوني بتكون غبي وعندك حمرنه جميع الحمير بالدنيا,News,Intelligence,yes,yes
 المخابرات العراقيه ساعدت امريكا بمكان ابو بقر البغدادي من ضربو بسوريا بس سبحان اله ما يعرفون الي يكتل بالمتظاهرين 🤓,News,Appearance,no,no
 عبد العزيز السليطي محل عبر برنامج تاهل السعودي الي الدور المقبل امر شبه محسوم,Sports,Racial,no,no
 قمه التقيه والنفاق تعزيه حسن لشعب الكويتي بوفاه الامير صباح الاحمد الصباح وتمنيه السلام لشعب الكويت وقد تناسي حسن ارهاب ميليشياته في الكويت ومحاوله قتل الامير جابر الصباح وخطف الطاءره الجابريه وخليه العبدلي الارهابيه وغيرها من الاعمال الارهابيه ضد وشعبها,News,Racial,yes,no
 الي يحط الصور بالعربيه يا انه قاصد او غبي خبر عن المساعدات الكويتيه والاماراتيه وجايبين صور المصارع المشنوق,News,Intelligence,yes,yes
 سب فشل الاتفاقيات السابقه هو المانعه المزعومه والنفوذ العلوي السوري وهذا المحور مهزوم الان,News,Intelligence,no,no
 يعرفه فاشل فاسد شريك بالخراب والدمار ويتلاقف اوامره علي انها كتاب منزل من السماء السذاجه والجهل بعينها,News,Intelligence,yes,yes
 توجيه تهم محاولات قتل ارهابيه الي منفذ هجوم باريس,News,Racial,no,no
 تبلغ منذ اسابيع بوجود المواد المتفجره ويقول انه لا صلاحيه له في 😅 يا حمار يا بلا ضمير,News,Intelligence,yes,yes
 بالامس كنا عرب ومسلمين عدونا واحد صديقنا واحد واليوم صار عدونا صديقا نحافظ عليهم ونعترف بهم ونقف امامهم مزلولين وصار صديقنا عدوا لنا نقتلهم ونعترض طريقهم الحكومه المصريه تعترض طريق الفلسطنين وتقف في طريق عودتهم لبلادهم عميل وخاين السيسي صهيوني,News,Racial,yes,yes
 اسكوبار وينك الفزعه حارس منا منا دبرها جبت لنا السابعه ماتعوق معاك حارس شكل لاكثر نرزه بالدكه افزع لنا,Sports,Appearance,no,no
 قال ابن وهب واخبرني عبد اله بن محمد بن عجلان عن عبيد اله بن عمر ان عمر بن الخطاب قال اتقوا الراي في دينكم,News,Racial,no,no
 رءاسه امن الدوله الاطاحه بالخليه الارهابيه انجاز لملكه وكل نجاح سعودي هو فشل لايران 🇸 🇦 🇸 🇦 🇸 🇦 🇸 🇦 🇸 🇦,News,Intelligence,no,no
 الهم ارحم عبدك وابدله دارا خيرا من داره وانتقم من الكلب,News,Appearance,yes,yes
 الاسطوره ليو ميسي الان علي بعد اهداف من كسر الرقم القياسي لبيليه في اكثر من سجل اهداف ل نادي واحد هدف هدف,Sports,Racial,no,no
 من وقت لوقت في حرق دواليب بس كل يوم في حرق اعصاب 🇱 🇧,News,Racial,no,no
 لما تكلم حد من بتوع ميسي افضل لاعب بالتاريخ و تقوله ازاي يا جدع ف ناس كتير مينفعش يتظلموا ولا انت شوفتهم كلهم ولا مديهم حقهم و تلاقي حمار بيتكلم و خلاص و لما تذكر لاعيبه كا مثال و يبدا يقتنع غصب عنه مش برضاه يهرب لحجه الارقام تيجي تكلمه ف الارقام نلاقي ده,Sports,Intelligence,yes,yes
 نظره ع الردود بتعرف ان لبنان قسمين قسم ارهابي ويمارس ارهابه بالسلاح والكلمه وقسم خاضع عارف جبروت الاول وماكل تبن وساكت فعلا رايح ع جهنم,News,Racial,no,yes
 عاجل المناظره الاولي ترامب لا يوجد رءيس امريكي حق انجازات مثلي,News,Sexual,no,no
 تموت الشعوب ليحيا الكلاب,News,Appearance,yes,yes
 ترك يعبث باليمن سوف يدمر بعد هذا الشخص عميل لخارج وينفذ مخط قذر,News,Sexual,yes,no
 بشتاقلك كل رفه عين وكل ما دق قلبي بحبك 💛,Celebrities,Appearance,no,no
 الشعوب العربيه ليست ميته والزلزال قادم لا محاله,News,Racial,no,no
 المحل السياسي حمدان الشهري ايران تضمر الشر ل السعوديه ويصعب الثقه فيها وكلمه خادم الحرمين الشريفين امام الام المتحده تناولت دورها التخريبي,News,Racial,yes,yes
 تهاميه امها الشمس فهي تكاد تضيء وابوها الريح فهي تكاد تطير الوحه لفنان عبد الوهاب عطيف,Celebrities,Racial,no,no
 بس ما افهم واذا جهلت عن هالنقطه صحوا لي كلامي هل راح يتعايشون مع الخليج العربي ونشوفهم بيوم بينا,News,Racial,no,no
 لم استشعر ضعف الكيان الاسراءيلي وقادته من قبل كما شعرت به اليوم حين سمعت القذر نتنياهو وهو يصرخ فرحا بهذا الانجاز,News,Sexual,yes,yes
 عين ماصلت علي محمد 💔,Sports,Appearance,no,no
 لكم عين تغردون خلاص قلبكم مات ماعاد تخافون لا من رب ولامن عباد اقضوا تصاريح المسلمين وافقوا عالطلبات اله يوقف حالكم وحال من تحبون ومن تعزون اله يرينا نصرنا فيكم,News,Appearance,yes,no
 جبران باسيل تم تصنيفه ارهابي وهذه المره الاولي في العالم التي يصنف فيها حيوان بالارهاب,News,Racial,yes,yes
 تحت ذريعه مواجه اطماع تم الانقلاب علي الشرعيه في جزيره وطردهامنهاواصبحت الامارات هي الامر والناهي فيهالم نري اي تواجدلتركيا في لكنا اليوم نري سفينه ايرانيه تدخل المياه اليمنيه ولا شفنا ابن كلب يتكلم عن العبث والتنسيق الاماراتي الايراني في اليمن,News,Appearance,yes,yes
 تصميم سيره ذاتيه بلغتين تصميم شعارات تصميم فديو تصميم شعار سناب تصميم فلتر سناب تعديل علي الاوراق ترجمه اي شيء من عربي الي انجليزي ومن انجليزي الي عربي,News,Racial,no,no
 وهل هذا الحقير المتجنس منذ خمس سنوات نسي ان العدو الصهيوني هو من احتل فلسطين واحتل قبله المسلمين الاولي,News,Racial,yes,yes
 شوفوا الاهبل الثاني 😭 😭,Gaming,Intelligence,yes,yes
 بفلوسنا يا عبيد ماش معروفي,Sports,Racial,yes,yes
 ستمتع بمشاهده القنوات عبر الانترنت ⭕ ️ اكثر من قناه عربيه وعالميه ⭕ ️ قوات متعده الجوده ⭕ ️ مكتبه فيلم و مسلسلات عربيه و عاليمه,Sports,Racial,no,no
 هل سنصبح غدا ولا نصبح علي ياشيخ عرب رحلت عنا وتركت فينا اثرا ندرس في اوطانينا رحم اله رجل الحكمه سمو الامير تنعي امير الكويت,News,Racial,no,no
 القدس ستظل عاصمه فلسطين العربيه الي الابد وسيظل الكيان الصهيوني مغتصب ولاكن سيءتي يوم ويطرد منها ويخرج منها حافيا,News,Sexual,no,yes
 جنون التقارير يتحدث الان عن انتقال ريغيلون وغاريث الي مع خروج ديلي الي الي اذا نظرنا ا,Sports,Intelligence,no,no
 اداره جهز فريق ضرب مخادمه في الدوحه واوجع ايران واذنابه في الرياض 😉,Sports,Racial,no,no
 السلام عليكم انا متزوجه وبلغت الان عام لكن جاني برود جنسي كليا بعد ماكنت طبيعيه هل السب العمر وشكرا,News,Sexual,no,no
 بشكل عام مرض نفسي خطير فما حال اذا كان تنمرا غبيا وسخيفا وبه قتل لموهبهعظيمه هل سيفرح كل من كتب حرفا ضد هذا الشخص,Celebrities,Racial,yes,no
 منذ ان غربت شمسه لم يشرق ل مانشستر يونايتد فجر جديد,Sports,Racial,no,no
 السعودي و الاماراتي والمصري و الصهيوني علي وساءل التواصل الاجتماعي كالكلاب المسعوره يبرون التطبيع,News,Appearance,yes,yes
 انت مش مصر مصر اكبر من اي حد انت موظف فاشل وثقنا فيه وضيعتنا وزي ما شلنا غيرك هنشيلك تحيا مصر,News,Intelligence,yes,yes
 محمد الدره في ذكري يوم استشهاده نسال اله الرحمه لشهداءهم والشفاء لجراح مصابينهم ويجبر برحمته قلوب الفاقدين صبرا فلسطين فالنصر الموعود قادم باذن اله لتحرير ارضك و تحرير المسجد الاقصي من براثن الصهاينه الغاصبين 🇵 🇸,News,Racial,yes,yes
 هذا الموسم سوف نستمتع كثيرا 😂 😂 تخيلو معي ان امس خسر بخماسيه امام بيتيس الارض كانت ستقوم ولا تقعد اليوم التبرير جاهز لمطبلي السب بالفشل هو الاعبين يومك اسود يا عفيفي ويا محمد عواد 🤯 🤯 😜 😜,Sports,Racial,no,no
 اصابه عنصرين من قوي الامن الداخلي جراء تعرض الدوريه لاطلاق نار من قبل مسلحين مجهولين علي اطراف بلده شمال شرق المدينه,News,Racial,no,no
 اكيد بيكون واحد من هذي الاشياء ما جاب جديد والخبر فاشل و ملينا من اخبار لبنان مافيه الا لبنان في العالم ا,News,Intelligence,yes,no
 ابن اي نوع من الابل هذا ابتسم منشان تركع يا وسخ,News,Appearance,yes,yes
 هذا الخبر اصبح كلب يعض شرطي نبغي الاخبار والمواقف الفلسطينيه الغريبه شرطي يعض كلب,News,Appearance,yes,yes
 بالصور نجاه عميد كليه الامام الاعظم في كركوك سامي زاير من محاوله اغتيال بعد استهداف سيارته بعبوه ناسفه,News,Racial,no,no
 روسيا دمرت البنيه التحتيه لسوريا من اجل انقاذ معتوه ذيل كلب ومن هذه البني المدارس لتقضي علي اجيال لاتجيد القراءه والكتابه وكان ذلك متعمدا حتي من المجتمع الدولي,News,Appearance,yes,yes
 ادلب قصف مدفعي عنيف مصدره ميلشيات الاسد الشيعيه يستهدف بلده كنصفره بريف ادلب وسط استمرار القصف الذي يستهدف منازل المدنين العزل,News,Racial,no,no
 بايدن ترامب فشل في مواجه ازمه كورونا,News,Intelligence,no,no
 جدت دعوتها لعقد مءتمر اقليمي لمناقشه المشاكل القاءمه شرقي البحر المتوسط وسبل حلها جاء ذلك في حديث وزير الخارجيه مولود تشاوش اوغلو لدي استضافته في اجتماع محري وكاله الاناضول في العاصمه انقره,News,Racial,no,no
 شبيحه تيار المستقبل نازلين يقولو سنيه سنيه طوءبروني معلي مهوي اذا في حدي حرق ام الطاءفه السنيه هوي الشخسعد تبعكن يعني عموره ربط زندك شوي وما تقلد علوشي,Celebrities,Racial,yes,yes
 لا جدال في كذبه لا اعترف براي ايا كان كورونا فيروس ضعيف جدا كغيره من الفيروسات بل اضعفها ستقول منظمه الصحه العالميه ساقول لك كول تبن يا بغل,News,Appearance,yes,yes
 اسمك محمد لكنك سقطت من عين امه محمد 🤚 🤚 وغزه تحت القصف,News,Appearance,no,no
 الصراحه هيا صدمه وما اتوقعتها ابدا ولكن اخر الزمان حيتكاتفو المسلمين مع اليهود وحيكون عدوهم واحد وهذه البدايه واله اعلم,News,Racial,no,no
 ماعلينا من نبح الكلاب اله الي عزنا وعز دولته بقياده ابو فهد,News,Appearance,yes,yes
 نقاش محلي يعجبني الاقتصادين من يصرون ان سب الانهيار الاقتصادي البناني هو تبني النموذج النيوليبرالي عمي حطولنا المرحومين ابو يعرب غازي كنعان وابو عبده الدكتور رستم غزالي ومعهما طويل العمر الحاج وفيق في جداول وبيانات اقتصاديه وتعالوا نتناقش بالاقتصاد,News,Racial,no,no
 مين اعطانا عين,Gaming,Appearance,no,no
 حاله الحزن المصريه علي وفاه المغفور له باذن اله امير الكويت الشيخ صباح الاحمد الجابر الصباح رساله حب وتقدير من الشعب المصري لاشقاء في وتاكيد علي فشل محاولات صنع الفتنه بين الاشقاء وان لا تنسي الايادي البيضاء التي امتدت اليها في ازمتها,News,Intelligence,no,no
 صحف عربيه تصب الزيت علي نيران الحرب بين واذربيجان,News,Racial,no,no
 ليس لانك تملك المال و تستطيع احتكار المسابقات ان تطلق خنازير يزمجرون باصوات قبيحه تقول عنهم معلقين يلهثون وراء احذيه الاعبين عصام الشوالي حفيظ دراجي رءوف خليف ربنا اطمس علي اموالهم,Sports,Appearance,yes,yes
 ارسل تعزيزات الي بلده بعد تعرض دوريه له لاطلاق نار,Celebrities,Racial,no,no
 يكلف شركهالمقاولون العرب المصريه باعاده اعمار ما دمره الانفجار,News,Appearance,no,no
 اعلنت السلطات الطبيه الهنديه ان اكثر من مليون هندي اي اكثر ب مرات من الارقام الرسميه قد يكونون اصيبوا بفيروس المستجد نقلا عن دراسه وطنيه تستند الي التحاليل المصليه التي تقيس الاجسام المضاده,News,Racial,no,no
 مسءول تافه ما بيعرف شو صاير بالدني و مسءول طرطور مش قادر يكون عكروت هوي شبه عكروت و مسءول حوت حرتقجي ملعب نصاب زنديق و تعتير الناس اخر همه طيب كيف بدك تبتي دوله فالج لا تعالج,Celebrities,Intelligence,yes,yes
 ماجيك كيبورد ايباد برو مقاس انش عربي انكليزي,News,Racial,no,no
 فيروز اعظم فنانه عربيه علي مر الزمن فيروز الرب يكون معك 🙏,News,Racial,no,no
 التنمر الالكتروني الذي يتعرض له الفنان الكبير الاستاذ يكشف عن سطحيه وسذاجه وجهل تفكير شعوبنا العربيه,Celebrities,Racial,yes,yes
 قال ﷺ بادروا بالاعمال ستا الدجال والدخان ودابه الارض وطلوع الشمس من مغربها وامر العامه وخويصه احدكم 📚 رواه مسلم ⬅ ️خويصه احدكم الموت,News,Racial,no,no
 حج محمد مصيبه انه دوله مكشوفه تلعب فيها جميع مخابرات الدنيا حتي انه هناك دول تافه تلعب في الساحه البنانيه,News,Intelligence,yes,no
 كورونا فلسطين وفيات و اصابه جديده,News,Racial,no,no
 قتلوا وحبسوا اسود الامه فعاثت الكلاب والقرود في الارض فسادا,News,Appearance,yes,yes
 واضح ان البهايم يحاولون يعملون سبام لحسابي 😂 الصياح علي قدر الالم نسخه الي عيال الكلب الي بهايم,News,Intelligence,yes,yes
 في مثل هذا اليوم استشهاد الطفل محمد الدره علموا اولادكم حقيقه هذه الصوره حتي يتربوا علي حب فلسطين وان فلسطين وعلموهم ان التطبيع خيانه له ورسوله ولمءمنين,News,Racial,no,no
 الاختلاف في السياسه حق طبيعي بل ومحبذ والاختلاف في السرد التاريخي مفهوم والاختلاف في تشخيص الحاضر كما في النظره الي المستقبل طبيعي ومتوقع لكن ان ينطلق هكذا اختلاف من لغه طاءفيه ومذهبيه فامر مقيت او ان يبني علي مفاهيم عرقيه وعنصريه فلامر خسيس وضيع,News,Racial,yes,yes
 لماذا منع الحجاج من الحج بينما شرعت ليهود الابواب كلها هل مسلم يحج وليس بيهودي 😂 دنيا عجيبه,News,Racial,no,no
 عبد الرحمن الشاطر عضو مجلس الدوله ما يفعله السراج والمشري وباشاغا خيانه لوطن,News,Racial,no,yes
 يا خساره شكله ما فيه لون اسود,Gaming,Racial,no,no
 هل تبد جريمه اغتصاب عدنان خوف المغاربه من التربيه الجنسيه,News,Sexual,no,no
 حدث خادم الحرمين يوجه باقامه صلاه الغاءب علي سمو الامير الراحل الشيخ صباح الاحمد بالحرمين الشريفين بعد صلاه العشاء,News,Racial,no,no
 النصر يعتلي صداره مجموعته في دوري ابطال اسيا بفضل السفاح عبد الرزاق حمداله,Sports,Racial,no,no
 بعد فشل التطبيع الهلالي مع الاهلي بدا التطبيع الهلالي مع الايرانين والذي سينتهي مع انتها مباره النصر السبت باذن اله,Sports,Intelligence,yes,no
 عن وما يجري حوله يتقاطع معه ويدور في خفاياه ما هي اراء صناع الاخبار وكيف تءثر في حياتهم في,Gaming,Appearance,no,no
 الغاز في شرق المتوسط العنوان المقبل لحروب والصفقات والتقاسم الدولي والاقليمي,News,Appearance,no,no
