id,text,domain,category,FinalOff,FinalCB
 نهايه المباراه بفوز الشوط الثاني حاول التركيز اكثر علي استغلال دفاع ليفربول المتقدم مع دخول سيبايوس الفريق نجح في الوصول من خلال تلك الكرات اكثر من مره ولكن فشل لاكازيت في التسجيل حده ضغط ارسنال انخفضت في الشوط الثاني ومنحت ليفربول اريحيه هجوميه واضحه,Sports,Intelligence,no,no
 ي خي علي كثر الايكات الي متفقين انها غثيثه وتافه بغض النظر عن الايكات كثير متفقين انها تافه تابعونها ليه خلاص انفلو ترجع لمزبله السوشال ميديا تسوي مثل عشان ترجع مشاهداتها بس انتم خليتو الي م يسوي التالي من الغنم يسوي,Celebrities,Intelligence,yes,yes
 وزير الخارجيه الارميني لسكاي نيوز عربيه تركيا ترسل مرتزقه وارهابين لدعم اذربيجان والاخلال بالسلام,News,Racial,yes,yes
 من رضع من ثدي الذل دهرا راي في الحريه خرابا و شرا و في العدو ابا و وصيا محمود درويش,News,Sexual,no,no
 🚨 عبد العزيز العفالق رءيسا لرابطه دوري المحترفين السعودي خلفا لمستقيل مسلي ال معمر,News,Racial,no,no
 معتز مطر اخبار مصر مظاهرات واشتباكات ومواجاهات عنيفه ودماء وفوضي وهروب ملاين السجناء اله غالب نلتقي بعد الفاصل بعد الفاصل قتلا بالمءات في شوارع مصر وفوضي عارمه ونهب وسرقات بالجمله الحلقه النهرده مولعه يافتاح ياعليم يارزاق ياكريم تبعتلنا مصايب من مصر,News,Appearance,no,no
 عبده عطيف واحمد عينين في راس دايم,Celebrities,Racial,no,no
 عبدالمجيد الصليهم نجم لقاء لكن ماعطوه افضل لاعب خايفين ياخذ افضل لاعب اسيوي لان منحها لحمدله ماراح يستفيد,Sports,Racial,no,no
 المغزي من كلامي انه شو ما صار البلد هاي رح تضل دوله طمعانه بالقرش وزي حاله احمد رح نشوف كتير طول ما البلد ما حسنت حالها ومن وضعها وهات الي يسمع يا خال اله يرحمك ويغفرلك ويعوض اهلك ويصبرهم,News,Racial,no,no
 بعد فلسطين وقطر الكويت تعتذر عن استلام رءاسه الدوره لمجلس جامعه الدول العربيه,News,Racial,no,no
 د عبيد الوسمي اعاده النظر في قوانين الامس لريبه في سلامه اجراءتها دستوريا,News,Racial,no,no
 كيف علقت فجر السعيد علي صوم رانيا يوسف,Celebrities,Racial,no,no
 بازير تدعو الي كسر طابوهات الاعتداءات الجنسيه علي الاطفال,News,Racial,no,no
 طز فيك وطز في حصارك وطز في التطبيع وانت اضعف من انك تهد ⚔ ️ 🇶 🇦 ⚔ ️,News,Racial,yes,yes
 اول مناظره بين و بتوقيت ولايه كاليفورنيا 🇺 🇸 مساء فجر الاربعاء صباحا بتوقيت 🇸 🇦,News,Racial,no,no
 صبري فواز وهيفا وهبي بكواليس اسود فاتح,Celebrities,Racial,no,no
 الكاظمي يكلف المقرب من المالكي القاضي علاء جواد حميد الساعدي رءيسا ل‍هيءه النزاه الاتحاديه حاميها حراميها,News,Sexual,yes,yes
 سوريا بلاد الخير والخيرات بلاد لم تعرف العوز يوما لانها مكتفيه ذاتيا اين هي الان شعبها يموت جوعا اجل جوعا وانتم صامتون هل تعلمون انه منذ سته اشهر الف طفل سوري لم يذق طعم الفاكه هل تعلمون ان الجوع كافر انتم يا عرب استفيقوا انتم عرب,News,Racial,no,no
 يلعن اصله ه,Gaming,Racial,yes,yes
 استشهاد امراتين واصابه اثنين احدهم طفل بجروح اثر قصف مدفعي لمرتزقه العدوان لمنازل المواطنين في منطقه الربصه بمديريه حسبنا اله ونعم الوكيل,News,Racial,no,no
 بدايه التطبيع اول خطوه دعمنا فلسطين قلبا وقالبا حبيبي دعمكم ما بدنا اياه انتو محراك الشر في الشرق الاوسط وقناه العربيه هي بالاساس عبريه صهيونيه كيف بدها تدافع عن فلسطين برنامجها 😂 لازم ترجعوا تشربوا بول البعير عن جديد بلكي بتشربوا الرجوله واسفاه 👎 🏻,News,Racial,yes,yes
 داءما مايرد جربان العرب مقوله حلب ماديا الحقيقه ان السعوديه حلبت ترامب سياسيا اسمع واحكم 👇,News,Appearance,yes,yes
 الامين العام لام المتحده فتك بمليون شخص حول العالم مرعب وصادم لعقل,News,Racial,no,no
 شكرا والباقي كلاب وجاين جوعانين بدهم ياكلو خير البلد ولا كانهم موجودين بالازمات,News,Appearance,yes,yes
 بصوا بقا احنا معاك ياريس في محاربه اي شء اخوان ارهاب عفاريت زرق لكن ترك وزير فاشل يبوظ عيالنا ويضحك علينا لا والف لا,News,Intelligence,yes,yes
 بس ينشال الدعم عن البنزين بالكامل رح تصير التنكه ب الف اذا حسبنا الدولار صار الاف اكيد الرقم تقديري واكيد اذا علي الدولار اكتر رح تصير اغلي يعني الكوارث بعد ما بلشت زياده كل شي متصل بشكل مباشر بالمحروقات متل الكهرباء رح تصير ضرب تنين او تلاته ويمكن اكتر,News,Racial,no,no
 لطيفه التونسيه حزينه ومقهوره ومصدومه بعد قتل واغتصاب رحمه,Celebrities,Racial,no,no
 هدف وليس حلم الكل توقع انفجار يوفنتوس بالميركاتو لكن اله يلعنك يابخيل,Sports,Racial,yes,yes
 من جمله معبره عن ما حدث اليوم نتنياهو فشل في ضم الضفه فضم الامارات,News,Intelligence,yes,yes
 اطلاق نار في الهواء لتفرقه المتظاهرين علي طريق,Celebrities,Racial,no,no
 🔴 الكل يعرف انكي مثل هاتف العمله تكلمين بمقدار النقود التي توضع داخلك 😷,Celebrities,Racial,yes,yes
 رءيس ارمينيا يناشد الملك السعودي سلمان بن عبد العزيز ولي عهده محمد بن سلمان بالتدخل عبر الدور السعودي في العالم وذلك لوقف اراقه الدماء والمعاناه حيث بعث برسالتين لهما جاء فيهما مه ليس هناك حل عسكري ويمكن حل النزاع عبر المفاوضات وساءل اعلام نقلا عن وكاله ارمن برس,News,Racial,no,no
 شاهد قبل الحدف مشاهده حلقات مسلسل اسود فاتح الحلقه السادسه عشر,Celebrities,Racial,no,no
 الثور فر من حظيره البقر الثور فر وبعد فتره حدثت حادثه مثيره لم يرجع ولكن لحقت به بقيه الحظيره احمد مطر,News,Appearance,yes,yes
 خسر كثيرا في جميع الملفات التي دخلها فشل بنتيجه تربيع مع اعلي مراتب الفشل حتي في التمنيه الاقتصاديه لبلده فشل,News,Intelligence,yes,yes
 هذا كلب 🐕 بالوان نمر 🐯 صور في الفلبين 🇵 🇭 وليس له علاقه بماليزيا او بغزه او العراق ❌ ❌,News,Appearance,no,no
 هذا غثني هو وايمه الاحول,Gaming,Appearance,yes,yes
 شكرا لوفاءكم ومهما قدمت لكم يا اهل نظل مقصرون امام بطولاتكم و صمودكم ورباطكم علي ارض فلسطين المقدسه و مواجهتكم لظلم الصهيوني الاستعماري وما تقدموه من تضحيات تجعلكم انتم الاعلون و ان كان البعض يخذلكم ويتامر عليكم اصمدوا رابطوا ينصركم اله عليهم وانا معكم,News,Racial,no,no
 لادوله ولاسياده ومفتوحه امام المجهولين لايوجد سوي ارهاب الدول لتبرير لحروب وتنفيد مصالح القوي الاستعماريه,News,Racial,no,no
 عون سعد نصر اله نبيه جعجع جنبلاط باسيل وغيرهم من رءساء الكتل السياسيه ان لم يختفوا من المشهد السياسي فلن تعود لبنان نراهم منذ صغرنا يذبحون لبنان ويقطعون اشجارها وبساتينها ويحرضون الاخ علي قتل اخيه,Celebrities,Racial,yes,yes
 😂 😂 انا شفت اغبياء بس غباء مركب زي الي عند لمعه العين الرخيصه جدا ابد ماشفت,Celebrities,Intelligence,yes,yes
 ظهور عارفه عبد الرسول بالمايو يسب لها انتقادات,Celebrities,Racial,no,no
 مجموعه فاشلين ما تسوا شي,Gaming,Intelligence,yes,yes
 اخبار عربيه الشيخ نواف الاحمد الجابر الصباح يءدي اليمين الدستوريه اميرا لدوله,News,Racial,no,no
 سنه الك وما عملت شي سنه الك وما لقطت حدا من الفاسدين او الي هربوا سنه الك وبعدك مثل الماي بلا طعم وبلا لون وبلا ريحه ولك عين تهت الثوره بمقابله مع ريكاردو كلام انو انتا مديت ايدك,Celebrities,Appearance,no,yes
 قام فريق مختص من الدفاع المدني السوري اليوم الاربعاء ايلول بدفن جثتي رجلين توفيا في مدينه الباب شرقي حلب يشتبه باصابتهما بفيروس متخذا اقصي تدابير الوقايه وكان الفريق دفن اليوم صباحا جثه رجل توفي و يشتبه اصابته بالفيروس,News,Racial,no,no
 شتم بايدن قال له انت ما تكلم عن الذكاء لانك تفتقر ليه وبايدن شتم لترامب قال له اخرس رءيس يعر بصراحه 😂 😂,News,Appearance,yes,yes
 قطع الطريق في ساحه الشهداء,Celebrities,Racial,no,no
 المسلمون ليس لهم علاقه ب بلد الدعاره والشواذ المسلمون بريءين من ارتكب المجازر في البلدان العربيه وسرق ثروات الشعوب,News,Sexual,no,no
 يناس غباء مو صاحي,Gaming,Intelligence,yes,yes
 عندي احساس اني فقر ونحس علي خليفتنا هل انا فقر,News,Racial,yes,no
 جهازك الصحي فاشل وانتم تعرفون ذلك الان في المطار اكثر من مسافر فحصو منذ اكثر من ساعات ولم تظهر النتيجه وهم محتجزون لان مختبراتكم وزاراتكم وحكوماتكم فاشله,News,Intelligence,yes,yes
 خادم الحرمين الشريفين يوجه باقامه صلاه الميت الغاءب علي الراحل الشيخ صباح الجابر الصباح بالحرمين الشريفين بعد صلاه العشاء,News,Racial,no,no
 رءيس واعضاء مجلس السياده الانتقالي في ينعون امير ويصفونه بانه قاءد عربي بارز كرس حياته لخدمه امته,News,Racial,no,no
 كل ما يكون في طيران حربي اسراءيلي فوق لبنان بدو يصير في يا مصيبه يا حريق وقد ما قوي كتير والعهد قوي اكتر ما حدا بيسترجي يقول انو هي السب عم يحصدونا حصد يا يا جبان ما فيك تشكل حكومه بقي ب يا منافق مين عم بفاوض مع العدو علي ترسيم الحدود مش انتوا,News,Racial,yes,yes
 كما تعد اكبر مصدر نفط لكيان الصهيوني حيث تزوده بحوالي من الاستهلاك السنوي ويصل النفط الاذربيجاني لتل ابيب عن طريق خط انابيب يمر عبر وتقوم شركه النفط الحكوميه لجمهوريه اذربيجان باعمال التنقيب عن النفط والغاز قباله سواحل فلسطين المحتله,News,Racial,no,no
 فلسطينيون ينظمون وقفه لدعاء لامير الراحل طيب اله ثراه,News,Racial,no,no
 منهل عزيز رءوف الحبوبي امينا لبغداد علاء جواد حميد رءيسا لهيءه النزاه مصطفي غالب محافظا لبنك المركزي,News,Sexual,no,no
 الهم انزل شفاءك علي من مسه الضر واجبر من انهكه الوجع الهم اشف وعاف والدي ومرضي المسلمين ️,News,Racial,no,no
 الحمدله علي الامريكي ولا عزاء لستور الفشل,Gaming,Intelligence,yes,no
 لبنان سويسرا الشرق جمالا و كمالا لكنه اليوم بعد وضع كيان غاصب بمحاذاه جنوبه و كسره و دحره اصبح قبله العالم بنصره و عزه و يحاول من شوه جماله ان يعيق كماله بقوته هيهات ان تنالوا من هذه القوه و في يوم اعلن الولاء و الوفاء لسيد امين عام الشهداء و الشرفاء,News,Appearance,no,no
 الاعتماد والامل الكلي في هذا الفريق الساذج بالمدرب النكره الارعن العين هو يتمحور في اليو العظيم,Sports,Racial,yes,yes
 شكرا علي التعزيه الخالصه في الوقت نفسه لم نشاهد فلسطيني يعزي شعب وشعوب بوفاه الشيخ رحمه اله عديمين الوفاء,News,Racial,yes,no
 اتوقع ان مافي احد يكون فاضي مثلي ويخلص التحديات كامله,Gaming,Sexual,no,no
 همجي متخلف متي نرتقي باسلوبنا,Gaming,Intelligence,yes,yes
 خادم الحرمين الشريفين يوجه باقامه صلاه الغاءب علي رحمه اله,News,Racial,no,no
 وقبل اسبوع فشل الرسمي والاعلامي في الحصول علي حقيقه بشان انفجار عين قانا وهي قد لا تكشف ابدا لكن الاكيد ان ايران تملا لبنان عبر حزبها الارهابي بمءات الالاف من الصواريخ وكل لبناني لا يعرف كيف هو المستقبل لانا اجبرنا علي ان نكون مستعمره ايرانيه,News,Intelligence,no,no
 الاتصال الهاتفي الذي اجراه الشيخ ال نهيان ولي عهد بالرءيس المصري عبد الفتاح حمل دعما غير محدود لقمع التظاهرات المطالبه ب اسقاط النظام التفاصيل كامله,News,Racial,no,no
 فاشل فاشل فاشل حتي بالقراه,Celebrities,Intelligence,yes,yes
 يعشقون وهو كافر 😒 ويعشقون وهو كافر 😒 ويعشقون وهو كافر 😒 طيب انا ☺ 😅 😂,Sports,Racial,yes,yes
 مستشفي الهمشري حالات ايجابيه من فحوصات مخالطين لاحد مصابي عين الحلوه,News,Appearance,no,no
 لكل فارس جواد ولكل جواد كبوه مادري علي شنو جبته,News,Sexual,no,no
 خاين السراج كلب الاغا استقال يا مينز تكبير 😂,News,Appearance,yes,yes
 واصدر الرءيس عبد الفتاح السيسي قرار رقم لسنه بدعوه مجلس النواب لانعقاد لدور الانعقاد السادس من الفصل التشريعي الاول في الساعه الثانيه عشره ظهر يوم الخميس الاول من اكتوبر وربنا يستر الهم انصرنا وكن معنا ولا تكن علينا يا اله,News,Racial,no,no
 و حياه امك,Celebrities,Sexual,no,yes
 مراسل قتلي وقوع اصابات حرجه جراء قصف صاروخي قرب مطار,News,Racial,no,no
 اطلاق نار علي احد مراكز الجيش واستشهاد عسكرين اثنين,Celebrities,Racial,no,no
 انتهي لتو في قناه برنامج ركز قبل مناظره علي امكانيه تزوير الانتخابات باختيار مجموعه من بلطجيه ترامب كل الهوسه تخليك تعتقد ان الانتخابات في عاصمه عربيه 😂 😂 😂 ملاحظه تري واله محد ساءل عنكم الاثنان يشتغلان لمصالح اميركا وشفطكم,News,Racial,no,yes
 بعد طرح الوزير البريطاني الفكره بعام واحد تداعي قاده و و الي القاهره لمناقشه فكره توثيق التعاون بين البلدان العربيه لتبدا بعد اشهر مشاورات عربيه انضم اليها مثلوا و و و,News,Racial,no,no
 نتانياهو يبشر بانفجار جديد في وبحلف عربي اسراءيلي,News,Racial,no,no
 انصدمت يوم مات الغبيه,Gaming,Intelligence,yes,yes
 كميه غباء مو طبيعي بالمتنمرين الشي اسمه قضاء وقدر ليش تفرون مصايبكم عنده عمره ما اذي حد وطول عمره يحب السلام,Celebrities,Intelligence,yes,yes
 احد الكويتين يضع نصب تذكاري امام منزله لخارطه فلسطين كامله اي واله الشهامه لها رجالها,News,Racial,no,no
 لم يكن مجرد حاكم فقد كان سمو رحمه اله ابا حنونا عزيزا علي كل كويتي فاحبه الكويتيون واجتمعوا حوله وساروا خلفه واثقين في عدله ونزاهته وحكمته مستظلين بانسانيته التي وسعت العالم كله لسنا كويتين لكن اهلنا في نقلوا لنا احساسيسهم فاحبنا اميرهم وفجعنا لفقده,News,Appearance,no,no
 بما ان اصبحت متداول الناس في مواقع التواصل هذا يءكد مدي نجاح شهرتها ليس من ناحيه المحتوي بل متطلب الواقع و من وجه نظري لكل شخص حاب ينشهر باسرع وقت في مجتمعنا فقط كل ما عليه يقدم لنا محتوي فاشل و بعد حين سنجح اغلب مجتمعنا يحارب الناجح و يدعم الفاشل,Celebrities,Intelligence,yes,no
 باجر ولده يجيب لكم اسراءليات شماحيط وتمارسون الدعاره وتنسون الكضيه 😂,News,Sexual,yes,yes
 بل هم جهال في الواقع فتبقي الامه شكلها شكل المتعلمه وحقيقتها انها جاهله فيكون في ذلك خيانه لامه كلها ودمار لمجتمع,News,Appearance,yes,yes
 اخر واحد كلب,Gaming,Appearance,yes,yes
 لقد خاب امل البنانين الذين راهنوا علي بدء التغير بعدما فشل تاليف الحكومه واعتذر الرءيس المكلف واصبحت البلاد امام المجهول,News,Intelligence,no,no
 شقفه كذاب منافق دجال المقاومه يناقض نفسه بنفسه فكل مره يطل فيها يكذب خطاب قديم له اسفي علي من يثق بهذا الخسيس البعيد كل البعد عن دين الاسلام,News,Racial,yes,yes
 يحق فوزا ثمينا علي في مباراه مجنونه,Sports,Racial,no,no
 هذا شان دول كبري اما دوله العصابات والمافيا فهي اخر من يتكلم,News,Intelligence,no,no
 بفضل اله كنت اكر ان صهيون العرب واخطر من الكيان الصهيوني نفسه,News,Racial,yes,yes
 نصر اله لماكرون نحن لا نمارس التخويف لكن دول عربيه تحميها وصديقه لك لا يتجرا احد فيها ان يكتب تغريده,News,Racial,no,no
 واله نفسي فيها بس خايف مافيها لغه عربيه والاستورات العربيه مافيها العرض,Gaming,Racial,no,no
 اردوغان وجونسون يتباحثان في اتصال هاتفي العلاقات بين تركيا وبريطانيا والتطورات شرقي البحر المتوسط والتوتر بين ارمينيا واذربيجان وقضايا اقليميه اخري,News,Racial,no,no
 يا خونه يا قذرين,News,Sexual,yes,yes
 دا مش مهرجان سينماءي لا دا مهرجان قلع يا جدعان نفسي اعرف ايه العاءد الي ب يعود عليهم من القرف الي احنا بنشوفه دا,Celebrities,Racial,yes,yes
 شكل الحلاقه عامله شغل مع صلاح 😂 عالمي يابني ️ 🌹,Sports,Appearance,no,no
 اله يلعن صباحك يا جبران باسيل انت و عمك,News,Racial,yes,yes
 بعد كلام سقط الجميع في وفي الخارج بالضربه القاضيه بلغه الجلد الناعم في لبنان اعيدوا حساباتكم فانقلابكم فشل الي الخارج مرحبا بكم بغير لهجه الاستعلاء فانتم لستم اوصياء علي لبنان الي فضحناك علي الهواء مباشره وعينا عليك,News,Intelligence,yes,yes
 يلعن حظه راس الاناناس,Gaming,Racial,yes,yes
 لا بنزين و لا دواء و لا مازوت و غلاء و وضع اقتصادي صعب و كذب و تهريب و صفقات و فساد و قمع و اسعار نار و مافيات سوق سوداء و اجرام و احتكار و مش معروف مصير رفع الدعم و بالاخر منحط الحق علي دول الخارج انو هني السب يا لكم من دجالين و كفار يا طبقه العهر,News,Racial,yes,yes
 يلعن امك,Gaming,Sexual,yes,yes
 تصريح عن سواريز متوقع جدا و لم يعد يهمه مصلحه برشلونه و هو ضرب عصفورين بحجر يكثف الهجوم ع الرءيس و يءكد انه مجبور بالجلسه اكيد لاسباب قانونيه في العقد غير كذا كان شفناه يلعب في مكان ثاني,Sports,Racial,no,no
 الماستف المتخلف,Gaming,Intelligence,yes,yes
 لن نخضع يا كلب 🇰 🇼 🇰 🇼 🇰 🇼 🇰 🇼,News,Appearance,yes,yes
 الهم لك الحمد حتي ترضي ولك الحمد اذا رضيت ولك الحمد بعد الرضاء اله يكتب الخير لاخوتنا الفلسطينين وينصرهم,News,Racial,no,no
 لا حول و لا قوه الا باله الحمداله الذي عافانا الهم سلم سلم قتل و اغتصاب تجرده الانسانيه من البشريه,News,Sexual,no,no
 كلنا فخورون بك يا سعاد فنجاحك نجاح لكل سوري يحلم بان يحق حلمه عبر العمل الجاد والمخلص لتحقيق هذا الهدف,News,Sexual,no,no
 انا كاهلالي جل تركيزي الان علي بطوله كاس خادم الحرمين الشريفين حفظه اله اذا خقته بكون جمعت افخم ثلاثيه تاريخيه بتاريخ 💙,Sports,Racial,no,no
 يوم اسود وطعنه من انظمه عربيه في الظهر هكذا وصف الفلسطينيون قياده وشعبا ما حدث من توقيع لاتفاقيات التطبيع,News,Racial,no,no
 وقد توقع الخبير الامريكي فشل بهذه الانتخابات لعده اسباب بعضا منها ماذكرته وهناك اخفاقات داخليه ايضا ويرجح فوز بايدن ولكني اري بان ترامب مازالت لديه فرصه لفوز,News,Intelligence,no,no
 ال هم الكلاب مع اعتذاري فالكلاب حفيظه لوفاء وهم الصوص القاتلون العاهرون وكلهم عبد بلا استثناء,News,Appearance,yes,yes
 اطلق صاحب السمو الشيخ محمد بن راشد ال مكتوم ناءب رءيس الدوله رءيس مجلس الوزراء حاكم دبي رعاه اله مشروع الامارات لاستكشاف القمر اول مهمه عربيه علميه لاستكشاف القمر في سابقه تدعم جهود الدوله في الارتقاء بقطاع الصناعات الفضاءيه,News,Racial,no,no
 خلي كلابكم تعلمكم الولاء يا عرب يا خونه,News,Appearance,yes,yes
 فضيحه دعم قطر لحزب الشيطان مو غريبه هم تعودو علي دعم كل جماعات التطرف في المنطقه,News,Sexual,yes,yes
 الرءيس المصري عبد الفتاح يشيد بالاتفاق الجديد بين الامارات والاحتلال الاسراءيلي ويثمن القاءمين عليه,News,Racial,no,no
