id,text,domain,category,FinalOff,FinalCB
 ورا كل هذا قالت اوبس هذا خطا من جانبنه وغزو العراق جان غلطه هذا كلام اوباما وترامب وطلع توني بلير كال اني اعتذر عن الغزو هيج بهالبساطه كانما واحد طخ جتفك بالشارع وكلك العفو وكتله لاعادي مصار شي,News,Racial,no,no
 قنوات المساعدات تاتي في اطار التوجيهات السديده من خادم الحرمين الشريفين الملك سلمان بن عبدالعزيز ولي عهده الامين لتقديم الاغاثه العاجله لمتضرين من الامطار والسيول في جمهوريه السودان,News,Racial,no,no
 ايه اكتر البوم فاشل و خايس في,Celebrities,Intelligence,yes,no
 قصف اذربيجاني يدمر راجمه صواريخ ارمينيه ويقتل ضابطا برتبه عقيد,News,Racial,no,no
 ميليشيات حفتر الخنزير ذيل دويله الخمارات وحضريه خنازير اوروبا فرنسا تعتقل شابا من قبيله القذاذفه المجاهده في سرت,News,Appearance,yes,yes
 الفاضل عبيد الوسمي يلاحظ في انتقاداتك لفساد و سردك لسرقات الكبري لمال العام منذ التحرير عدم ذكر اكبر سرقه تمت بحق اموال المواطنين و مدخراتهم التامينات الاجتماعيه من فهد الرجعان خذ مثلا وثيقه الكويت ان فاتني ذكرني جزاك اله خير,News,Racial,no,no
 واله القي ذا متخلف ه,Gaming,Intelligence,yes,yes
 واحد اكملنا ارينا ابك ابو عرب الافضل,Gaming,Racial,no,no
 مشكله الغلو في الملوك واصحاب الشان الكثير صاروا يشوفونهم صح حتي لو كانو غلط,News,Appearance,no,no
 مسيره نساءيه سلميه الي عين التينه,Celebrities,Appearance,no,no
 اله يرحمه مكتوبله يموت نضيف عاش ومات رافض التطبيع مع الكيان الصهيوني علموا اولادكم ان فلسطين محتله وان المسجد الاقصي اسير وان الكيان الصهيوني عدو وان المقاومه شرف وانه لايوجد دوله اسمها اسراءيل,News,Racial,no,no
 خلص انا بقول ما يعملوا لا اجراءات ولا هبل خلص مناعه القطيع وبس,News,Intelligence,no,no
 شخصيات عربيه رحيل الشيخ صباح الاحمد خساره كبيره لعالم اجمع,News,Racial,no,no
 يارب لفوز باراحه و من غير حرق الدم 🙂 ️,Sports,Racial,no,no
 اله اله يا الاستاذ الكبير والمحترم لا يوجد عربي شريف لايحب الكويت شكرا استاذي علي هذي الكلمات الطيبه ان دلت تدل علي معدنك الاصيل,Celebrities,Racial,no,no
 الان مظاهرات كبيره تعم ارجاء قريه العواميه بالاقصر وذلك عقب مقتل المواطن رميا بالرصاص علي يد قوات امن بعد اقتحام قريته فجر اليوم علي خلفيه التي خرجت تعلن رفضها لحكم,News,Racial,no,no
 تضيع ما تبقي من دماغ هبل هبل هبل واله هبل,News,Intelligence,yes,yes
 سريلانكا تحظر ذبح الابقار,News,Racial,no,no
 جلاله الملك المفدي يوجه لاقامه صلاه الغاءب علي امير الكويت الراحل بعد صلاه فجر غد الخميس,News,Racial,no,no
 غدروا بها اقرب الناس اليها وجعلوها هاربه من تهمه فساد وجريمه قتل فتقر الانتقام من الجميع يعرض الان علي,Celebrities,Racial,no,no
 دا وانا مني معرقه,Gaming,Sexual,no,no
 نفذ حزب اله منذ قليل عمليه امنيه اعلاميه ادت الي جعل نتنياهو اضحوكه الاعلام وحمت لبنان من اي تهور صهيوني او فجور لمتناغمين معه في الداخل,News,Sexual,yes,yes
 اذا برشلونه طموحهم مدافع مثل جارسيا يذهب بارتاميو وزمرته لمشاهدته مافعله فاردي اليوم وبعدها سيعرفون ان جارسيا فاشل,Sports,Intelligence,yes,yes
 المدرعات تغزو شوارع المقهوره المخروسه مع اقتراب العشرون من سبتمبر ما اجبنك واخزاك يا نذل يا خسيس,News,Racial,yes,yes
 مين مكن يكون وراء جريمه قتل عادل في تابعوا الاحداث من الاربعاء لسبت الساعه عالجديد,Celebrities,Racial,no,no
 ابتي الغالي لن نرضي بيع فلسطين وسنرجع ان عادت فينا عين الجالوت وحطين جيلك يا ابني جيل الثوره والحر بعمره ما يهون,News,Appearance,no,no
 بعد تطبيقه علي عشرات المصابين بمرض الاشمانيا من مراجعي مشفي الامراض الجلديه التابع لجامعه دمشق وتحقيق نتاءج ايجابيه في قتل الطفيليات المسبه لمرض منحت مديريه حمايه الملكيه كلا من عميده كليه الصيدله بجامعه دمشق الدكتوره جميله حسيان,News,Racial,no,no
 قاعده اذا شفت قناه الجزيره الخبيثه تحاول تثير العاطفه نحو فلسطين فاعلم بان الغرض تجنيد مقاتلين ل تركيا احذر,News,Racial,yes,yes
 حزب الشعب يهاجم فشل الاقتصادي دفع لحظر منتجاتنا ويقودنا ل الافلاس التفاصيل,News,Intelligence,no,no
 كتاءب القسام نطمءن الجميع بان مواقعنا الالكترونيه ستعود لعمل قريبا رغم انف عدونا متجاوزين كل التحديات والعقبات,News,Appearance,no,no
 بس يا عرص هذه قضيه كل شرفاء الامه العربيه و الاسلاميه,News,Sexual,yes,yes
 انا عايز نعرف الناس البهايم الي بينتخبو مايفهموش سياسه ولا اقتصاد اعتذر عن كلمه بهايم,News,Intelligence,yes,yes
 التطبيع خيانه لدماء الشهداء خيانه لارض خيانه لعرب وشعوب العرب,News,Racial,no,no
 اغلب اتباع الاحزاب مابدن يسمعوا و يشوفوا بكل بساطه مش انو فهمانين شو عم يكتبوا مشيوا بقصه ال مليار و كل واحد نقل الخبر شكل و عزقوا و فتش بحبش بيكون ابنه او خيه او اخته او بنته او هو اخد منحه مثلا موله من هالمصريات قصه ارتفاع الدولار رجوع الحريري غباء,Celebrities,Intelligence,no,no
 كتبت قبل الثوره بصبحك يا شعب تعب من التعب عايش بعتمه فاسد وناطر النور ناطور صرلو سنين ماخلي عنب لا خير لا هوا ولا مي تنشرب وبتصدقو انو رح يوقف فجور ما تعتبو عاحاكم استغبي ونهب كل العتب عا شعبنا يلي انتخب نفس الطقم نفس الحكم هوني العتب الناطور ما رح يقتل الناطور,Celebrities,Sexual,no,yes
 يجد عقد لاعبه الشاب انسو حتي وقيمه كسر العقد مليون يورو,Sports,Racial,no,no
 السكار البكاي بكيت وبكيت وخربت ليبيا ومشيت اله يلعنك,News,Racial,yes,yes
 من سنه بلشت ثورتنا ضدن بليله نزل الكل عالطرقات و قال ايه شبعنا كذب بعدين شو صار نزلوا القوات و الكتاءب باعتقادهم المشكله بالعهد و بس انطلق من وقتها من ابواق نتنه بهدف ضرب الثوره كلها لابقاء اركان السلطه,Celebrities,Racial,yes,yes
 حرق لاحداث قريت تعليق حول مهمه وكان التعليق يتكلم عن هدف مايكا في المهمه وهدف دتش,Gaming,Racial,no,no
 الحديده قصف مدفعي وصاروخي لقوي العدوان ب قذيفه وصاروخي كاتيوشا علي غرب قريه الشجن وعلي قريتي الجربه والدحفش باطراف مدينه الدريهمي المحاصره,News,Racial,no,no
 تقول ان عشره مدنين قتلوا في قصف لقوات,News,Racial,no,no
 بفلسطين كل يوم في محمد دره جديد وكل يوم في شهيد بقدم روحه عشان ارضه اله يرحمك يا محمد ويرحم جميع اطفالنا و شهداءنا فلسطين قضيه حق مش قضيه مجموعه من الناس لن نسي وما اخذ بالقوه لا يسترجع الا بالقوه,News,Racial,no,no
 موتمركم فاشل ياشباب عطونا الاسعار,Gaming,Intelligence,yes,yes
 لا تقارن الوسخ مع الذهب اله ينصر اردوغان علي اندال الامه الاسلاميه امين منذ اليوم سامجد اردوغان اكثر,News,Appearance,yes,yes
 الحمار وهو صغير الحمار لما يكبر,Celebrities,Intelligence,yes,yes
 اقوه ترند عربي او ربما له كاريزما ملهما لتعامل مع المسلسلات العربيه من كلام علي ورق الي مسلسل فنانه او مثله تجيد كل شي ترفع لها القبعه,Celebrities,Racial,no,no
 فاشل ومنحاز لايران لانه ضعيف ويخضع لاوامر الدوله العميقه التي لها حقدتاريخي ضد السني وتحالف مع كل عدو لعرب والاسلام السني بسب خسارتهم ل و والان و موجوده بكل ازمات المسلمين,News,Intelligence,yes,yes
 هذا اليفر مخيف هذا اليفر مرعب لكل خصم يواجه سيء الحظ من يقابل هذا الزعيم الكاسح 😎 ️ ️,Sports,Appearance,no,no
 لما تصير عبد شتقن ضدي انا بصير كحلي,Gaming,Racial,yes,yes
 يلعن ابو التفاه,Gaming,Racial,yes,yes
 حسين الجسمي لسه مكمل في طريق الانحطاط من بعد الرقص ع جث و دماء الناس و التعريص لكل نظام فاسد محبش يفوته لحس احذيه الصهاينه و يعرفنا ان وساخته مالهاش حدود يا وسخ,News,Sexual,yes,yes
 العرب احق من اليهود في الاحتفال ب عيد المساخر,News,Racial,yes,yes
 حمار مع احترامنا لحمار,News,Intelligence,yes,yes
 سءال لمفتي حاكم المطيري هل يجوز لشواذ والقوادين وفتيات اليل معصيه ولي الامر والعمل بلا ترخيص,News,Sexual,yes,no
 بيناتنا مين غير ترامب مجنون وبيقدر يهد الاستيذ ويقول له لقد اعذر من انذر,News,Intelligence,yes,yes
 مراجعه وتقيم لعبه سيرفرات محليه ولغه عربيه فهل انتم مستعدين,Gaming,Racial,no,no
 نفوذ السلاح مع استمرار ظهور الاسلحه في ما انواعها واين تصنع رابط التحقيق الكامل انجز بدعم واشراف شبكه اريج اعلاميون من اجل صحافه استقصاءيه عربيه,News,Racial,no,no
 واخيرا اتوجه لكل سياسي وقول انو يا فاسد يا حرامي يا مسير يا فاشل مهما علا شانو واليوم كان يوم شرف لكل نايب قدم استقالتو وما شارك بالمسرحيه يلي هي ولكل من هوي خارج السلطه الحاليه,Celebrities,Intelligence,yes,yes
 مفيش سلام مع مغتصب ارض,News,Sexual,yes,yes
 اكد الاكاديمي والخبير الاقتصادي المقيم في اميركا جواد صالحي اصفهاني بانه لولا الحظر الاميركي المفروض علي الجمهوريه الاسلاميه الايرانيه لتمت الحيلوله دون وفاه الف شخص ايراني بسب تفشي فيروس كورونا,News,Sexual,no,no
 الشعب العربي وين والشعب الاصيل وين 💔 💔 وعلي الدنيا السلام,News,Racial,no,no
 شفنا كيف كانوا اجانب امس مبدعين جميعا وكيف كان تاثيرهم علي الفريق اختيارات فيتوريا داءما تكسب 👍 🏻,Sports,Racial,no,no
 ان قوما يلتقون بالبشر والسلام فاذا تفرقوا طعن بعضهم علي بعض انهم اعداء في الغيب اخوه في التلاق اخلاقهم كانما شقت من النفاق,News,Racial,yes,no
 كذبه كبيره خداع مستمر غباء فاقع هجرتونا دمرتونا خدعتونا قتلتونا امهات فقدت اولادها اولاد فقدوا اهاليهم,News,Intelligence,yes,yes
 طارق المزرم عدم استخراج لجميع الجنسيات الا بعد موافقه الجنه الوزاريه لطوارء,News,Sexual,no,no
 يلعن ابوه المحظوظ,Gaming,Racial,yes,yes
 عن مقتل اول مرتزق في من نقلتهم مءخرا لقتال ضد والقتيل هو محمد شعلان عبد الرزاق مقاتل في صفوف فرقه الحمزه من ابناء مدينه غرب,News,Racial,no,no
 الكونغرس الاميركي يمنع بيع السلاح الي اردوغان الارهابي في ظل ازمته مع جيرانه تحيه خاصه الي ماما امريكا وبابا ترامب,News,Racial,yes,yes
 قال رسول اله صلي اله عليه وسلم مثل المءمنين في توادهم وتراحمهم وتعاطفهم مثل الجسد اذا اشتكي منه عضو تداعي له ساءر الجسد بالسهر والحمي,News,Sexual,no,no
 المرجح بعد فشل تاليف الحكومه وسقوط المبادره ان تطول فتره حكومه تصريف الاعمال ويعود حسان دياب الي الواجه ويفي رءيس الجمهوريه بوعده,News,Intelligence,no,no
 حياكم في سناب شات و و لكمه جديده في جسد المترنح و وجلب لعله يخف كوارث ولغز الالماني وحاجه الي اشهر من اكتشاف نفسه كمدرب وتعاقدات الشيبان الي يعشقها انتظركم 🌹,Sports,Sexual,no,no
 الخارجيه الايرانيه وزير الخارجيه محمد جواد يتوجه الي غدا لقاء كبار المسءولين في العاصمه,News,Sexual,no,no
 تاق يحمل الكثير من المرايع المرياع خروف خصي يتبع الحمار ويقف بجانبه لاكن المشكله بالغنم الي تبع المرباع,News,Intelligence,yes,yes
 احمد الشخانبه في ذمه اله من طلب العلا حرق حاله روب تخرج وقداحه طموح فقر اردن موت احلامنا تدفن تحرق تعدم تنتحر تسجن تذبح لكنها لا تموت,News,Racial,no,no
 احزاب سياسيه يمنيه تطالب باخراج مليشيات المدعومه من من ميناء بمحافظه شبوه شرقي اليمن,News,Racial,no,no
 يوم قلعنا عين دول العدوان وماضين في قلع العين الثانيه,News,Appearance,no,no
 جثمان امير الراحل الشيخ صباح الاحمد يواري الثري في مقبره الصليبيخات شمال شرقي البلاد,News,Racial,no,no
 اذا سالت عن تعريف جماعه الاخوان المسلمين قل هم مزبله جميع البدع,News,Racial,yes,yes
 📍 علاج كسر و لسيد قاسم الشطناوي مع الدكتور البقاعي لاستفسار 📱 🙂 نستقبلكم بفرعينا,News,Racial,no,no
 الحقد هو اخر مراحل الفشل 💔,News,Intelligence,no,no
 كابتن ابراهيم انت طالبت بمدرب اجنبي هل مدرب نفسيا يناسب الاهلي وهل خلت من مدرب اعتقد اول مره مدرب افريقي يقود رايك لو سمحت,News,Racial,no,no
 ضياع كل ما حقه لبنان والانقلاب علي شرعيه الدوله ومءساتها ونهب لمقدرات الخزينه تحت عين وسمع,Celebrities,Appearance,no,no
 الشخص التافه لا يعكر مزاجك اتفقنا اتفقنا 🤝,News,Intelligence,yes,yes
 اليهود كالكلاب اذا وقفت معهم يلهثون او تركهم يظلون يلهثون حتي يصلون الي هدم الاسلام في قلوبنا,News,Appearance,yes,yes
 طقم ثلاث قطع ميز 💥,News,Racial,no,no
 قوات الامن المصريه بالاقصر تستخدم الرصاص الحي لتفرقه المتظاهرين المطالبين بمحاسبه قاتل عويس الراوي,News,Racial,no,no
 مدير المرصد السوري لحقوق الانسان رامي عبد الرحمن شيوخ الفصاءل المواليه ل يصدرون فتاوي بجواز القتال مع وعلي المجتمع الدولي وقف تجنيد السورين كمرتزقه,News,Racial,no,no
 الانجاز الوحيد الي عمله انه قدر يقنع الحمار انه بيفهم ذي الي في الفيديو كدا بالظبط 😂 👇,News,Intelligence,yes,yes
 اطلاق نار في والجيش يتدخل ويوقف اشخاص,Celebrities,Racial,no,no
 خادم الحرمين في برقيه لشيخ نواف الاحمد الصباح الملكه العربيه و يجمعهما مصير مشترك واحد صحيفه البلاد,News,Racial,no,no
 الثناءي الشيعي البناني يقبل ان يكون كلب عند الفرس الهمج علي ان يكون انسان عاقل في لبنان 👉 حقيقه مره,News,Appearance,yes,yes
 بينهم عنصران من شبان يتناوبون علي اغتصاب فتاه بعد قتلها في ريف في حي دف الشوك,News,Sexual,no,no
 يقف امام العالم ليستغبي المستوطين ويكذب عليهم بانه يعلم مكان مخازن صواريخ الدقيقه نتنياهو عدو غبي هو مستعد ان يكشف خطه امام المقاومين فقط من اجل تسجيل نقطه في سبيل الفوز في انتخابات الكيان كل ذلك خوفا من السجن الذي ينتظره في قضايا الفساد,News,Intelligence,yes,yes
 🔴 احد اقارب الطفل المنحور زكريا تم صدور حكم الاعدام بحق قاتل الطفل زكريا الجابر القاتل الذي ارتكب هذه الجريمه بابشع الصور في نحرا امام والده الطفل في جمادي الاولي من عام ه,News,Racial,no,no
 شاهد قبل الحدف مسلسل اسود فاتح الحلقه الثامنه عشر,Celebrities,Racial,no,no
 عبد الهيان و مجرد لاعبين في سيرك يقوده,Celebrities,Racial,no,no
 ما فيه ما يتحب واحد بلعوط لا دين لا مله و خاصه فاشل مايعرفش كوعو من بوعو,News,Intelligence,yes,yes
 الرءيس عبد الفتاح السيسي يوجه بتطوير منظومه المخابز في انحاء مصر,News,Racial,no,no
 لاهثين خلف التطبيع وزير الخارجيه العماني يءكد الارض مقابل السلام حل الدولتين اقامه دوله فلسطين وعاصمتها القدس الشرقيه,News,Racial,no,no
 السءال المهم من اطلق يد بهذا الشكل المستفز في المنطقه ومن يقف خلفها بشكل متخفي لتمارس هذه العربده,News,Appearance,yes,no
 الشيخ عبد اله بن زايد لن نتخلي عن مطالبه باعاده الجزر الاماراتيه المحتله,News,Racial,no,no
 انتم لصوص ثروات العرب ودمار العرب و برعايه الاذناب الخونه حثاله العرب,News,Racial,yes,yes
 وسخ اوي في حوار المنظارات عشواءي وبيقاطع كتير ودي حاجه عامله فوضي في القنوات الي بترجم باتنين مترجمين لكن عموما الصحافه الامريكيه من الصبح بتقول انه هيعمل كده,News,Appearance,yes,yes
 يا ريت سيرين عبد النور و امل بوشوشه حضرو الحفل كانو عدلو مزاجنا من هل مناظر 🥴,Celebrities,Racial,yes,yes
 بشتقلك كل رفه عين وكل مادق قلبي بحبك 💖 💗 💗,Celebrities,Appearance,no,no
 زار الرءيس اليوم سفاره دوله حيث قدم التعازي بوفاه امير الكويت الي السفير عبد العال القناعي,News,Racial,no,no
 علي اعلانات سهره اغاني ل ال ح ق ي ر ه المتناقضه العنصريه يعني زعيترات يقولون لكم طز فيكم,Celebrities,Racial,yes,yes
 ما قاله عين الصواب فشكرا لك وله وتبا لاذناب من عرفنا ومن لن نعرف تحياتي لك,News,Appearance,yes,no
 وان فراقك كسر قلوبنا 💔 رحمك اله وابدلك دارا خيرا من دارك وعوضك اله جنه الفردوس الاعلي عن كل التعب الذي بذلته من اجل الكويت وشعبها وجميع بلاد المسلمين والعالم باكمله يا امير الانسانيه 🇰 🇼,News,Racial,no,no
 حزب نشا لكي يخسر سبقه جماعه حسم وجماعه الحامد والفقيه والمسعري يظنون انهم سيخلدون مجدا من ورق بانشاء حزب ديموقراطي اعطني دوله عربيه ديموقراطيه واحده ناجحه ولن تجد لكن جميع الدول الملكيه العربيه مستقره وناجحه ك والامارات وقطر ايضا,News,Racial,no,no
 حسين الجسمي اكبر عن تفاهات كلاب وكر الوجبه وشويه الخرفان في تركيا وبعض الدول الاخري حسين الجسمي ايقون,Celebrities,Appearance,yes,yes
 صلاح يا مجنون,Sports,Intelligence,yes,yes
 ماشاء اله عين الحسود فيها عود,News,Appearance,no,no
 الخمه دافعين ثمن الصواريخ الي تم اطلاقها علي القطاع كلاب واله مايطهرون كل هذا علشان توقيع الاتفاقيه,News,Appearance,yes,yes
 وتخجل الروم من اباحيه عربنا,News,Sexual,yes,yes
 بايدن يتهم ترامب بانه عنصري,News,Racial,yes,yes
 قصف صاروخي في بغداد,News,Racial,no,no
 الشي المقرف ان الغبي سيتين بيكر غلطه النمله بالخطه ضد ليفربول وهو التحفظ والاعتماد علي الحظ قبل ميسي,Sports,Appearance,yes,yes
 وحده الوطن يصنع الاحداث ويكتبنا كيفما شاء مادمنا حبره مستغانمي الوطن مخيف اكثر من الزنزانه,Celebrities,Appearance,no,no
 اله لا يسلم بك مغز ابره يا خنزير,News,Appearance,yes,yes
 بعد ايام علي الفاجعه الاليمه نعي اليكم فقيد تفجير مرفا بيروت الشهيد الحاج حسين عبد الرحيم بشر في جنان الخلد,News,Racial,no,no
 اله يلعنك يا ادواردو ويلعن الي اعطاك منصب,Sports,Racial,yes,yes
 شو يا خروات خوفكم من تركيا خلاكم تكشفوا وتقلعوا ملط يلعن شرفكن كلاب ولاد كلاب الي مزبله التاريخ يا خنازير,News,Appearance,yes,yes
 بعض المتشدين هنا في وسم لا يعرفوا من الصلوات الا اساميها حميه جاهليه نتاجها قتل وفقر وتشريد,News,Appearance,no,yes
 خلصت الثوره 😂 😂 😂 اه يا شعب اهبل,News,Intelligence,yes,yes
 فشل حكومه نتنياهو في مواجه فيروس كورونا اضافه الي العديد من تهم الفساد التي تلاحقه سبت موجه غضب داخلي ضده فتدخل الكنيست لاخماد الاحتجاجات المناهضه بحضر التظاهرات بذريعه تفشي فيروس كورونا مسخره المارقين لن تقوم لهم قاءمه,News,Intelligence,yes,no
 مادري ليش كل هالخوف معقول الشعب جاهل ومختل وجبناء بالشكل هذا مو قادرين يتجراون يسبون حزب,Celebrities,Appearance,yes,yes
 رءيس مجلس السياده الانتقالي الفريق اول ركن عبد الفتاح البرهان يلتقي وزير الخارجيه الاثيوبي غيدو اندارجاشو الذي نقل له تحايا رءيس الوزراء الاثيوبي ابي احمد ومسانده ومءازره اثيوبيا لسودان في مجابه كارثه السيول والفيضانات,News,Racial,no,no
 الشرطه الاميركيه تعلن تعاملها مع عمليه احتجاز رهاءن في ولايه اوريغون اعقبت اطلاق نار اسفر عن سقوط قتلي بينهم مشتبه به,News,Racial,no,no
